{
  "version": 1,
  "books": [
    { "id": "00000000-0000-4000-8000-000000000001", "title": "坊っちゃん", "totalPages": 300, "lastPage": 72, "addedAt": "2026-10-01T20:00:00" },
    { "id": "00000000-0000-4000-8000-000000000002", "title": "こころ", "totalPages": null, "lastPage": 40, "addedAt": "2026-10-02T20:00:00" }
  ],
  "sessions": [
    { "id": "00000000-0000-4000-8000-000000000101", "bookId": "00000000-0000-4000-8000-000000000001", "startedAt": "2026-10-05T21:00:00", "durationSeconds": 600, "endPage": 20, "pagesRead": 20, "savedAt": "2026-10-05T21:10:30" },
    { "id": "00000000-0000-4000-8000-000000000102", "bookId": "00000000-0000-4000-8000-000000000001", "startedAt": "2026-10-12T21:00:00", "durationSeconds": 1200, "endPage": 45, "pagesRead": 25, "savedAt": "2026-10-12T21:20:30" },
    { "id": "00000000-0000-4000-8000-000000000103", "bookId": "00000000-0000-4000-8000-000000000001", "startedAt": "2026-10-20T21:00:00", "durationSeconds": 1800, "endPage": 72, "pagesRead": 27, "savedAt": "2026-10-20T21:30:30" },
    { "id": "00000000-0000-4000-8000-000000000201", "bookId": "00000000-0000-4000-8000-000000000002", "startedAt": "2026-10-03T22:00:00", "durationSeconds": 900, "endPage": null, "pagesRead": null, "savedAt": "2026-10-03T22:15:30" },
    { "id": "00000000-0000-4000-8000-000000000202", "bookId": "00000000-0000-4000-8000-000000000002", "startedAt": "2026-10-10T22:00:00", "durationSeconds": 1500, "endPage": 40, "pagesRead": 40, "savedAt": "2026-10-10T22:25:30" }
  ],
  "active": null,
  "flags": { "firstOpenedAt": "2026-10-01T19:55:00", "firstSessionStarted": true, "first5minDone": true, "weekReachedWeekStart": null }
}
